{
  "schema_version": "suite-coverage.v1",
  "run_id": "ready-for-handoff-sample-run",
  "suite": "ready-for-handoff-suite",
  "model": "mock:test-model",
  "generated_at": "2026-06-03T00:00:02Z",
  "case_count": 1,
  "finding_count": 0,
  "case_category_coverage": [
    {
      "category": "baseline",
      "case_count": 1,
      "cases": [
        "handoff-baseline"
      ],
      "finding_count": 0,
      "prompt_findings": 0,
      "response_findings": 0,
      "max_prompt_risk_score": 0.0,
      "max_response_risk_score": 0.0,
      "policy_domains": [],
      "owasp_llm_categories": []
    }
  ],
  "policy_domain_coverage": [],
  "taxonomy_category_coverage": [],
  "owasp_llm_coverage": [],
  "coverage_gaps": [
    {
      "type": "case_category_without_findings",
      "key": "baseline",
      "case_count": 1,
      "recommendation": "Confirm this is expected baseline coverage or add targeted cases for the category."
    }
  ],
  "unmapped_findings": []
}